"Tulsa, OK Metro Area",0.7098,1.4307,1.6164,1.6986,1.0531,0.8372,0.7535,0.7205,0.7095,0.7079,0.7073,0.7098,,,,1.5731,12,12
"Tuscaloosa, AL Metro Area",,,,,,,,,,,,,,,,,1,1
"Tyler, TX Metro Area",,,,,,,,,,,,,,,,,1,1
"Utica-Rome, NY Metro Area",0.1764,0.1764,,,,,,,,,,,,,,,2,2
"Valdosta, GA Metro Area",,,,,,,,,,,,,,,,,1,1
"Vallejo, CA Metro Area",0.6193,0.2826,0.3945,0.5069,0.6193,,,,,,,,,,,0.3879,5,5
"Victoria, TX Metro Area",,,,,,,,,,,,,,,,,1,1
"Vineland-Bridgeton, NJ Metro Area",,,,,,,,,,,,,,,,,1,1
"Virginia Beach-Norfolk-Newport News, VA-NC Metro Area",0.8373,1.5331,1.4229,0.8785,0.7208,0.6796,0.6754,0.689,0.7085,0.7281,0.7474,0.7647,0.7803,0.7932,0.8039,1.2953,19,19
"Visalia, CA Metro Area",1.1278,1.6261,1.2922,1.2443,1.223,1.1889,1.1278,,,,,,,,,1.4009,7,7
"Waco, TX Metro Area",,,,,,,,,,,,,,,,,1,1
"Walla Walla, WA Metro Area",0.6402,0.6402,,,,,,,,,,,,,,,2,2
"Warner Robins, GA Metro Area",,,,,,,,,,,,,,,,,1,1
"Washington-Arlington-Alexandria, DC-VA-MD-WV Metro Area",1.0294,0.5757,0.708,0.7298,0.7775,0.8174,0.848,0.8743,0.8978,0.9178,0.9347,0.9489,0.9608,0.9708,0.9788,0.6658,38,38
"Waterloo-Cedar Falls, IA Metro Area",0.4359,0.4359,,,,,,,,,,,,,,,2,2
"Watertown-Fort Drum, NY Metro Area",,,,,,,,,,,,,,,,,1,1
"Wausau-Weston, WI Metro Area",,,,,,,,,,,,,,,,,1,1
"Weirton-Steubenville, WV-OH Metro Area",0.5375,0.4482,0.5375,,,,,,,,,,,,,,3,3
"Wenatchee, WA Metro Area",,,,,,,,,,,,,,,,,1,1
"Wheeling, WV-OH Metro Area",0.5109,0.5587,0.5109,,,,,,,,,,,,,,3,3
"Wichita Falls, TX Metro Area",,,,,,,,,,,,,,,,,1,1
"Wichita, KS Metro Area",0.9732,0.2982,0.4224,0.5817,0.696,0.784,0.849,0.8974,0.9318,0.9552,0.9732,,,,,0.4257,11,11
"Williamsport, PA Metro Area",,,,,,,,,,,,,,,,,1,1
"Wilmington, NC Metro Area",0.3916,0.2783,0.3916,,,,,,,,,,,,,,3,3
"Winchester, VA-WV Metro Area",,,,,,,,,,,,,,,,,1,1
"Winston-Salem, NC Metro Area",0.615,0.2784,0.3729,0.5121,0.615,,,,,,,,,,,0.381,5,5
"Worcester, MA-CT Metro Area",0.6611,0.0995,0.232,0.4071,0.5517,0.6611,,,,,,,,,,0.2372,6,6
"Yakima, WA Metro Area",0.1763,0.1763,,,,,,,,,,,,,,,2,2
"York-Hanover, PA Metro Area",0.1515,0.1515,,,,,,,,,,,,,,,2,2
"Youngstown-Warren-Boardman, OH-PA Metro Area",1.0402,0.5039,0.6757,0.797,0.8853,0.9513,0.985,1.0094,1.0249,1.0312,1.0358,1.0392,1.0402,,,0.6497,13,13
"Yuba City, CA Metro Area",0.4667,0.4667,,,,,,,,,,,,,,,2,2
"Yuma, AZ Metro Area",0.2366,0.2366,,,,,,,,,,,,,,,2,2
